Product Name,Price
Диван Льери Мини Velvet Light,64 990
Диван Нумо Velvet Yellow,36 990
Диван Тут Рядом Дом Серо-графитовый,72 990
Диван угловой Эби-1 Velvet Coral,72 990
Диван Бонент Velvet Eclipse,74 990
Диван Нумо Мини Textile Yellow,24 990
Диван Тут Рядом Космос Светло-Бежевый,109 990
Диван Линс Velvet Navy Blue,32 990
Кресло Тут Рядом Дом Сине-бежевый,50 990
Диван угловой Эдвин Velvet Smoke,72 990
Диван Бруквиль Velvet Blue,49 990
Диван Байма Velvet Grey,69 990
Диван Спейс Velvet Beige,62 990
Диван угловой Беллер Textile Yellow,40 990
Кресло Бенел Cozy Ivory,33 990
Диван Нумо Velvet Grafit,36 990
Кресло-кровать Маре Мини Velvet Grafit,21 990
Диван Клаймар Velvet Beige,56 990
Пуф Тут Рядом Дом Серо-графитовый,15 990
Диван Марей Soft Grey,89 990
Диван Сваут Velvet Grey,64 990
Кресло Бенел Cozy Beige,33 990
Диван Линс Velvet Grafit,32 990
Диван угловой Аронт Мини Velvet Pink,56 990
Диван Рейли Velvet Coral,36 990
Диван угловой Вайвел Barhat Forest,89 990
Диван Бруквиль Velvet Smoke,49 990
Пуф Тут Рядом Красавчик Светло-бежевый,34 990
Диван Коренс Happy Grey,29 990
Диван угловой Шера Velvet Light,99 990
Диван Види Textile Ocean,23 990
Пуф Тут Рядом Дом Зеленый,15 990
Кресло Пайл Barhat Beige,22 990
Модульный диван Brera-2 Velour Mix,105 980
Кресло Гета Soft Silver,30 990
Диван угловой Нумо Velvet Yellow,46 990
Модульный диван Нолан-B 3 Soft Jungle,114 970
Диван Тут Рядом Дом Сине-бежевый,72 990
Кресло Элвит Cozy Ivory,29 990
Диван Сваут Velvet Mustard,64 990
Кресло Рибс Velvet Beige,26 990
Пуф Кропс Bucle Smoky,8990
Пуф Лонди Cozy Beige,11 990
Диван Мисл Barhat Mint,74 990
Диван угловой Мейлон Velvet Eclipse,49 990
Кресло Тут Рядом Дом Розовый,50 990
Диван Нумо Мини Textile Light,24 990
Диван угловой Бонент Velvet Grey,89 990
